{
  "schema_version": 1,
  "assessment_id": "evassess-req-001-v3",
  "requirement_version_id": "req-v-001",
  "statement": "The workbench shall restore only a complete, hash-verified generation.",
  "status": "evidence_assessed",
  "claims": [
    {
      "claim_id": "claim-complete-generation",
      "text": "Recovery accepts only complete generations.",
      "mandatory": true,
      "evidence_bindings": [
        {
          "evidence_id": "evidence-architecture-generation",
          "relationship": "supports",
          "source": {
            "source_id": "source-gui-architecture",
            "version_id": "gui-architecture-v1",
            "content_sha256": "2c26b46b68ffc68ff99b453c1d30413413422d706483bfa0f98a5e886266e7ae",
            "locator": "docs/gui/architecture.md#7-generation-发布模型",
            "authority_class": "controlled"
          },
          "retrieval_methods": ["exact", "bm25", "vector"],
          "vector_score": 0.86,
          "rerank_score": 0.92,
          "assessor_reason": "The source explicitly requires manifest and resource verification before recovery."
        }
      ]
    }
  ],
  "retrieval": {
    "candidate_count": 8,
    "supporting_count": 1,
    "contradicting_count": 0,
    "unresolved_critical_contradictions": 0,
    "source_coverage": 1.0,
    "claim_coverage": 1.0,
    "best_vector_score": 0.86,
    "best_rerank_score": 0.92
  },
  "evidence": {
    "support_strength": 0.91,
    "authority_score": 0.95,
    "applicability_score": 0.9,
    "freshness_score": 1.0,
    "trace_completeness": 1.0
  },
  "gate": {
    "readiness": 0.93,
    "decision": "eligible",
    "generation_eligibility": true,
    "reason_codes": [],
    "policy_version": "evidence-policy-v1",
    "evaluated_at": "2026-07-24T10:00:00Z"
  },
  "retrieval_receipt": {
    "query_digest": "sha256:1c8bfe8f801d79745c4631d09fff36c82e05d86a4d55b57f1098b70ea5f0d9a7",
    "retrieval_profile": "hybrid-controlled-v1",
    "embedding_model": "example-embedding-model-v1",
    "reranker_model": "example-reranker-v1",
    "candidate_evidence_ids": ["evidence-architecture-generation"],
    "executed_at": "2026-07-24T09:59:30Z"
  }
}
